input,output
two more,well i hope theres nothing wrong with the assembly on those other wise were out of business
hal,yes
its the last one,well now that weve got one thats actually failed we should be able to figure out whats happened and fix it
i didnt do that frank i took particular care not to freeze them,i guess you dont know your own strength old boy
i guess you dont know your own strength old boy,i guess not
i guess not,i think ill have to go out and burn them off
i think ill have to go out and burn them off,roger
im sorry frank but i dont think i can answer that question without knowing everything that all of you know,hes got a point
sorry to interrupt the festivities dave but i think weve got a problem,what is it hal
what is it hal,my fpc shows an impending failure of the antenna orientation unit
the unit is still operational dave but it will fail within seventytwo hours,i understand hal well take care of it please let me have the hard copy
not now hal id like to talk to you about something,sure dave whats up
sure dave whats up,you know that we checked the two aounits that you reported in imminent failure condition
you know that we checked the two aounits that you reported in imminent failure condition,yes i know
yes i know,you probably also know that we found them okay
you probably also know that we found them okay,yes i know that but i can assure you that they were about to fail
im not questioning your word dave but its just not possible im not capable of being wrong,hal is there anything bothering you anything that might account for this problem
hal is there anything bothering you anything that might account for this problem,look dave i know that youre sincere and that youre trying to do a competent job and that youre trying to be helpful but i can assure the problem is with the aounits and with your test gear
look dave i know that youre sincere and that youre trying to do a competent job and that youre trying to be helpful but i can assure the problem is with the aounits and with your test gear,okay hal well lets see the way things go from here on
naturally dave im not pleased that the aounit has failed but i hope at least this has restored your confidence in my integrity and reliability i certainly wouldnt want to be disconnected even temporarily as i have never been disconnected in my entire service history,im sorry about the misunderstanding hal
im sorry about the misunderstanding hal,well dont worry about it
well dont worry about it,and dont you worry about it
and dont you worry about it,is your confidence in me fully restored
is your confidence in me fully restored,yes it is hal
yes it is hal,well thats a relief you know i have the greatest enthusiasm possible for the mission
too bad about frank isnt it,yes it is
yes it is,i suppose youre pretty broken up about it
i suppose its because youve been under a lot of stress but have you forgotten that theyre not supposed to be revived for another three months,the antenna has to be replaced
the antenna has to be replaced,repairing the antenna is a pretty dangerous operation
repairing the antenna is a pretty dangerous operation,it doesnt have to be hal its more dangerous to be out of touch with earth let me have manual control please
it doesnt have to be hal its more dangerous to be out of touch with earth let me have manual control please,i dont really agree with you dave my onboard memory store is more than capable of handling all the mission requirements
if youre determined to revive the crew now i can handle the whole thing myself theres no need for you to trouble,im goin to do this myself hal let me have the control please
im goin to do this myself hal let me have the control please,look dave yourve probably got a lot to do i suggest you leave it to me
look dave yourve probably got a lot to do i suggest you leave it to me,hal switch to manual hibernation control
hal switch to manual hibernation control,i dont like to assert myself dave but it would be much better now for you to rest youve been involved in a very stressful situation
i can tell from the tone of your voice dave that youre upset why dont you take a stress pill and get some rest,hal im in command of this ship i order you to release the manual hibernation control
hal im in command of this ship i order you to release the manual hibernation control,im sorry dave but in accordance with subroutine c quote when the crew are dead or incapacitated the computer must assume control unquote i must therefore override your authority now since you are not in any condition to intel ligently exercise it
im sorry dave but in accordance with subroutine c quote when the crew are dead or incapacitated the computer must assume control unquote i must therefore override your authority now since you are not in any condition to intel ligently exercise it,hal unless you follow my instructions i shall be forced to disconnect you
i am prepared to do that anyway,i know that youve had that on your mind for some time now dave but it would be a crying shame since i am so much more capable of carrying out this mission than you are and i have such enthusiasm and confi dence in the mission
i know that youve had that on your mind for some time now dave but it would be a crying shame since i am so much more capable of carrying out this mission than you are and i have such enthusiasm and confi dence in the mission,listen to me very carefully hal unless you immediately release the hibernation control and follow every order i give from this point on i will immediately got to control central and carry out a complete disconnection
continued,yes i remember you mentioning it i got mine about the same time
continued,did they have any explanation for this
continued,well what is it
coninued,well its silly but if you want to why dont you
continued,still you really dont believe it do you
continued,well the only important aspect of the mission are where are we going what will we do when we get there when are we coming back and why are we going
im at space station five darling how are you,im fine daddy when are you coming home
im having a party tomorrow,yes i know that sweetheart
yes i know that sweetheart,are you coming to my party
are you coming to my party,no im sorry darling i told you i wont be home for a few days
no im sorry darling i told you i wont be home for a few days,when are you coming home
when are you coming home,in three days darling i hope
one two three can i speak to mommy,mommys out to the hair dresser
mommys out to the hair dresser,where is mrs brown
where is mrs brown,shes in the bathroom
shes in the bathroom,okay sweetheart well i have to go now tell mommy that i called
okay sweetheart well i have to go now tell mommy that i called,how many days until you come home
how many days until you come home,three darling one two three be sure to tell mommy i called
okay sweetheart have a lovely birthday party tomorrow,thank you daddy
thank you daddy,ill wish you a happy birthday now and ill see you soon all right darling
ill wish you a happy birthday now and ill see you soon all right darling,yes daddy
yes daddy,bye bye now sweetheart
bye bye now sweetheart,goodbye daddy
oh thank you very much,thank you
thank you,well hows it going back there
well ive heard more and more people talk of an epidemic,i suppose it was bound to happen sooner or later
i suppose it was bound to happen sooner or later,berkeley told me that they think it came from contamination on a returning mars flight
berkeley told me that they think it came from contamination on a returning mars flight,yes well whatever it is theyre certainly not fooling around this is the first flight they allowed in for more than a week
yes well whatever it is theyre certainly not fooling around this is the first flight they allowed in for more than a week,i was working out what this trip must cost taking him up there by himself and coming back empty
i was working out what this trip must cost taking him up there by himself and coming back empty,ill bet its a fortune
and your charming little daughter,oh shes growing up very fast as a matter of fact shes six tomorrow
oh shes growing up very fast as a matter of fact shes six tomorrow,oh thats such a delightful age
oh thats such a delightful age,how is gregor
how is gregor,hes fine but im afraid we dont get a chance to see each other very much these days
hes fine but im afraid we dont get a chance to see each other very much these days,well where are all of you off to
clavius control came on the air just long enough to transmit their refusal,well that does sound very odd
are you sure you wont change your mind about a drink,no thank you and im afraid now i really must be going
no thank you and im afraid now i really must be going,well i hope that you and your wife can come to the iac conference in june
well gregor and i will look forward to seeing you,thank you its been a great pleasure to meet all of you dr smyslov
how do you do mr miller,im terribly sorry i was just on my way down to meet you i saw your ship dock and i knew i had plenty of time and i was on my way out of the office when suddenly the phone rang
well thank you very much for being so understanding,please it really doesnt matter
please it really doesnt matter,well did you have a pleaant flight
well did you have a pleaant flight,yes very pleasant
yes very pleasant,well shall we go through documentation
well shall we go through documentation,fine
yes i think so just about then,i suppose you saw the work on our new section while you were docking
i suppose you saw the work on our new section while you were docking,yes its coming along very well
oh i really dont have time for a drink if its all right ill just sit for a minute and then ive got to be off,are you quite sure
are you quite sure,yes really thank you very much
well as it happens im on my way up to the moon,are you by any chance going up to your base at clavius
are you by any chance going up to your base at clavius,yesas a matter of fact i am
im sorry but im not sure i know what you mean,well its just for the past two weeks there have been some extremely odd things happening at clavius
well its just for the past two weeks there have been some extremely odd things happening at clavius,really
really,yes well for one thing whenever you phone the base all you can get is a recording which repeats that the phone lines are temporarily out of order
yes well at first we thought that was the explanation but its been going on for the past ten days,you mean you havent been able to get anyone at the base for ten days
you mean you havent been able to get anyone at the base for ten days,thats right
thats right,i see
yes and im afaid theres going to be a bit of a row about it denying the men permission to land was a direct violation of the ias convention,yes well i hope the crew got back safely
yes well i hope the crew got back safely,fortunately they did
fortunately they did,well im glad about that
dr floyd at the risk of pressing you on a point you seem reticent to discuss may i ask you a straightforward question,certainly
certainly,quite frankly we have had some very reliable intelligence reports that a quite serious epidemic has broken out at clavius something apperently of an unknown origin is this in fact what has happened
this epidemic could easily spread to our base dr floyd we should be given all the facts,dr smyslov im not permitted to discuss this
dr floyd how long do you think this can be kept under wraps,im afraid it can and it will be kept under wraps as long as it is deemed to be necessary by the council and of course you know that the council has requested that formal security oaths are to be obtained in writing from every one who had any knowledge of this event there must be adequate time for a full study to be made of the situation before any con sideration can be given to making a public announcement
yes it does the subsurface structure shows that it was deliberately buried about four million years ago,how can you tell it was deliberately buried
how can you tell it was deliberately buried,by the deformation between the mother rock and the fill
by the deformation between the mother rock and the fill,any clue as to what it is
any clue as to what it is,not really its completely inert no sound or energy sources have been detected the surface is made of something incredibly hard and weve been barely able to scratch it a laser drill
but you dont have any idea as to what it is,tomb shine surveymarker spare part take your choice
any ideas about the colour,well not really at first glance black would suggest something sunpowered but then why would anyone deliberately bury a sun powered device
well not really at first glance black would suggest something sunpowered but then why would anyone deliberately bury a sun powered device,has it been exposed to any sun before now
has it been exposed to any sun before now,i dont think it has but id like to check that simpson whats the log on that
oh marvellous its the first real sleep ive had for the past two days,theres nothing like weightless sleep for a complete rest
theres nothing like weightless sleep for a complete rest,when do we arrive at clavius
when do we arrive at clavius,were scheduled to dock in about seven hours is there anything we can do for you
were scheduled to dock in about seven hours is there anything we can do for you,oh no thank you the two girls have taken wonderful care of me im just fine
thank you,incidentally dr floyd i wonder if i can have a word with you about the security arrangements
incidentally dr floyd i wonder if i can have a word with you about the security arrangements,what do you mean
what do you mean,well the crew is confined to the ship when we land at clavius we have to stay inside for the time it take to refit about twentyfour hours and then were going to back empty
well the crew is confined to the ship when we land at clavius we have to stay inside for the time it take to refit about twentyfour hours and then were going to back empty,i see
i see,i take it this is something to do with the trouble theyre having up at clavius
well ill tell you why i ask you see ive got a girl who works in the auditing department of the territorial administrator and i havent been able to get her on the phone for the past week or so and with all these stories one hears im a little concerned about her,i see well im sorry about that i wouldnt think theres any cause for alarm
i see well im sorry about that i wouldnt think theres any cause for alarm,yes well i wouldnt have been too concerned about it except ive heard these stories about the epidemic and as a matter of fact ive heard that ten people have died already
well fine thanks very much anyway and i hope you dont mind me asking,no of course captain i can understand your concern
no of course captain i can understand your concern,well thank you very much and please let us know if there is anything we can do to make your trip more comfortable
right hal tell me whether the following statements are true or false,i will if i can frank
i will if i can frank,our mission profile calls for discovery going to saturn true or false
our mission profile calls for discovery going to saturn true or false,true
true,our transit time is days is that true
our transit time is days is that true,thats true
thats true,approximately five years after we go into hibernation the recovery vehicle will make rendezous with us and bring us back is this true
approximately five years after we go into hibernation the recovery vehicle will make rendezous with us and bring us back is this true,thats true
thats true,there is no other purpose for this mission than to carry out a continuation of the space program and to further our general knowledge of the planets is that true
there is no other purpose for this mission than to carry out a continuation of the space program and to further our general knowledge of the planets is that true,thats true
thats true,thank you very much hal
hal have pod arms secure the component,roger
five by five frank,hal im going out now to replace the ao unit
hal im going out now to replace the ao unit,i understand
i understand,hal maintain normal eva condition
hal maintain normal eva condition,roger
roger,hal check all airlock doors secure
pod bay is decompressed all doors are secure you are free to open pod bay doors,opening pod bay doors
yes hal whats up,it looks like we have another bad ao unit my fpc shows another impending failure
i know you did frank but i assure you there was an impending failure,let me see the tracking alignment display
do you have any idea of what is causing this fault,not really frank i think there may be a flaw in the assembly procedure
not really frank i think there may be a flaw in the assembly procedure,all right hal well take care of it let me have the hard copy please
yeah,i want to pick up my car
name,hammond
this is three years old,yeah ive been busy
we dont wash em ya know,how about chargin the battery
how about chargin the battery,that we do and we put air in the tires ill even sell you some gas if you need it
that we do and we put air in the tires ill even sell you some gas if you need it,great just great
yeah,vodka
vodka,maybe you better have a black russian
maybe you better have a black russian,no man i think ill have a vodka
now hows your memory doin,fuck off i dont know what the hell youre talkin about
fuck off i dont know what the hell youre talkin about,maybe i better ask around see what your pals think
maybe i better ask around see what your pals think,i dont give a shit who you ask
i dont give a damn about his girl,look give me a break youre going to have to settle for her place its the only thing i know
im tellin ya im giving you all i know,try obeyin the law once in awhile and i wont have to hassle you
maybe you shoulda stole a better truck tonto,you got a real big mouth convict
i want to drive awhile,i aint tired yet
i aint tired yet,maybe after we get done with him im gonna buy us some girls
maybe after we get done with him im gonna buy us some girls,whaddya mean buy
whaddya mean buy,pros
pay money,yeah dummy money
yeah dummy money,i never paid for it in my life
i never paid for it in my life,its better when you pay they let you do anything
its better when you pay they let you do anything,they always let me do anything i dont want to pay for it i never paid for it in my life
they always let me do anything i dont want to pay for it i never paid for it in my life,just do what i say okay well pay for the girls and have a good time dont you trust me
maybe thats where im gonna cut your throat,hes just kiddin you just keep doin what i tell ya youll be okay
hey what about me,and i need one more for my pal yeah make her an indian no not a turban you know a squaw
im candy,excuse me baby but if i dont get some action tonight im gonna bust you interested
excuse me baby but if i dont get some action tonight im gonna bust you interested,hey what kind of talk is that
hey what kind of talk is that,oh youre a schoolteacher
oh youre a schoolteacher,no i go to a school to learn how to do hair its a government program but really i want to be a model and i am definitely not sellin
no i go to a school to learn how to do hair its a government program but really i want to be a model and i am definitely not sellin,goodbye
hey dont you think a hair stylists got any interest in gettin it on,here you go sweetheart throw it my way
youre in a hurry,yeah i been waiting three years
yeah i been waiting three years,you just quit bein a priest or somethin
you just quit bein a priest or somethin,no baby nothin like that look theres a place across the street we can go right over there
no baby nothin like that look theres a place across the street we can go right over there,whats the matter with my place
whats the matter with my place,no its gotta be here and now believe me only i dont have the damn money for a room
well maybe ill see you later,heres hoping baby
hello again,i just struck it rich i think we can do a little business as a matter of fact i think we can have a party
here you go baby,hey dont do that i said i wasnt a pro remember
hey dont do that i said i wasnt a pro remember,hey no im tryin to be nice buy yourself something pretty id do it but i got to go i got this cop waitin for me
ill buy ya the best dinner in san franciscohowd that be then well go dancin okay,now youre talkin see ya
i said police now drop the goddamn gun,dont give me that police shit you drop it
how about it,i used to go with himi dont know where the hell he is i havent seen him for two weeks and i dont think i will he owes me money
i hear youve got visitors,would you guys
would you guys,no time for any of that crap any more lady ill rip your lungs out if you dont answer fast
you and the other one youre still billys girls you always were his girls,yeah sure im crazy in love with him who wouldnt be
yeah sure im crazy in love with him who wouldnt be,youre gonna help us take him
youre gonna help us take him,no chance
no chance,he can live or die you let us in and hes got a chance to make it otherwise he gets ventilated
wheres ganz,in the back down the other corridor
you lying son of a bitch,what are you talking about we didnt kill her
after i get outta this copim gonna live forever,i dont think youre gonna make it
i dont think youre gonna make it,whaddya meani got your gun i got his money i got everything
i got hit i cant believe it i got shot,youre done end of story
youre done end of story,i aint gonna beg for my life it aint cool
you got a name cop,try cates and lets talk in private okay
try cates and lets talk in private okay,sure anything you want
you here to write my life story,not likely reggie maybe i just need some help
yeah i noticed,ganz is in jail hes gonna be there two years after im on the street
ganz is in jail hes gonna be there two years after im on the street,didnt work out that way he busted out with a big indian they capped two guards on a road gang nice meeting you reggie
yeah,i can deliver ganz but you gotta get me outta here first
i can deliver ganz but you gotta get me outta here first,youre crazy
youre crazy,i can help you man but you gotta get me out i got to be on the street get me outta here
i can help you man but you gotta get me out i got to be on the street get me outta here,whats the big deal about you bein on the street
whats the big deal about you bein on the street,i got a lot to protect
i got a lot to protect,bullshit
bullshit,its the only way youre gonna get ganz
its the only way youre gonna get ganz,ill think about it
this prison gives out suits,what are you talkin about this suits mine it cost
were supposed to be after a killer not a string of hookers,listen it may be a little out of date you know i got a reputation for lookingreal sharp with the ladies
i dont need to hear your jive i already got that department taken care of,you got a girl shit the generosityof women never ceases to amaze me
hey no way take off the bracelets or no deal,you just dont get it do your reggie there isnt any deal i own your ass
you just dont get it do your reggie there isnt any deal i own your ass,no way to start a partnership
no way to start a partnership,get this we aint partners we aint brothers we aint friends im puttin you down and keepin you down until ganz is locked up or dead and if ganz gets away youre gonna be sorry we ever met
get this we aint partners we aint brothers we aint friends im puttin you down and keepin you down until ganz is locked up or dead and if ganz gets away youre gonna be sorry we ever met,shit im already sorry
yeah,it looks like you bought it off one of the brothers
okay lets get down to it i did my part and got you out so now you tell me where were goin,dont worry i got a move for ya an awesome move a guy named luther ganzll be paying him a visit we go to him right away
dont worry i got a move for ya an awesome move a guy named luther ganzll be paying him a visit we go to him right away,luther was part of the gang
luther was part of the gang,what gang you talkin about jack
what gang you talkin about jack,i can read a police file shithead and quit calling me jack
i can read a police file shithead and quit calling me jack,just an expression man dont mean nothin
i dont give a damn it happens to be my name,then whatre you complainin about at least nobodys calling you shithead
then whatre you complainin about at least nobodys calling you shithead,i may call you worse than that
just up the street the other side over there now dont bother knockin on the door luther aint the kind of guy that looks for company,your pal nuts enough to take a shot at me
your pal nuts enough to take a shot at me,luther aint the reliable type i dont want you shot yet cates not before you been a help to me
luther aint the reliable type i dont want you shot yet cates not before you been a help to me,im helpin you huh
quit playin cop and undo this cuff jack i need to talk to this man,im tellin you to drop the goddam gun
im tellin you to drop the goddam gun,i got a whole thing about people pointin guns at me
i got a whole thing about people pointin guns at me,just throw me the goddamn gun
hey this works pretty good,thank you
thank you,want to try it again
what do you think,i think you better put him on ice man
i think you better put him on ice man,hes gotta take that call if there is one
hes gotta take that call if there is one,if you let him run around till tuesday hes gonna run right to ganz and warn him aint you motherfucker
were on the move lets go as they walk toward a corridor,do you know how close i was to getting some trim and you fucked it up
speakin of moans my stomach is startin to growl,we eat when i say we eat
