input,output
can we make this quick roxanne korrine and andrew barrett are having an incredibly horrendous public break up on the quad again,well i thought wed start with pronunciation if thats okay with you
well i thought wed start with pronunciation if thats okay with you,not the hacking and gagging and spitting part please
not the hacking and gagging and spitting part please,okay then how bout we try out some french cuisine saturday night
youre asking me out thats so cute whats your name again,forget it
no no its my fault we didnt have a proper introduction,cameron
cameron,the thing is cameron im at the mercy of a particularly hideous breed of loser my sister i cant date until she does
the thing is cameron im at the mercy of a particularly hideous breed of loser my sister i cant date until she does,seems like she could get a date easy enough
why,unsolved mystery she used to be really popular when she started high school then it was just like she got sick of it or something
unsolved mystery she used to be really popular when she started high school then it was just like she got sick of it or something,thats a shame
gosh if only we could find kat a boyfriend,let me see what i can do
cesc ma tete this is my head,right see youre ready for the quiz
right see youre ready for the quiz,i dont want to know how to say that though i want to know useful things like where the good stores are how much does champagne cost stuff like chat i have never in my life had to point out my head to someone
i dont want to know how to say that though i want to know useful things like where the good stores are how much does champagne cost stuff like chat i have never in my life had to point out my head to someone,thats because its such a nice one
thats because its such a nice one,forget french
how is our little find the wench a date plan progressing,well theres someone i think might be
there,where
you got something on your mind,i counted on you to help my cause you and that thug are obviously failing arent we ever going on our date
you have my word as a gentleman,youre sweet
how do you get your hair to look like that,ebers deep conditioner every two days and i never ever use a blowdryer without the diffuser attachment
sure have,i really really really wanna go but i cant not unless my sister goes
i really really really wanna go but i cant not unless my sister goes,im workin on it but she doesnt seem to be goin for him
shes not a,lesbian no i found a picture of jared leto in one of her drawers so im pretty sure shes not harboring samesex tendencies
lesbian no i found a picture of jared leto in one of her drawers so im pretty sure shes not harboring samesex tendencies,so thats the kind of guy she likes pretty ones
so thats the kind of guy she likes pretty ones,who knows all ive ever heard her say is that shed dip before dating a guy that smokes
hi,looks like things worked out tonight huh
you know chastity,i believe we share an art instructor
have fun tonight,tons
i was,you never wanted to go out with me did you
well no,then thats all you had to say
then thats all you had to say,but
but,you always been this selfish
do you listen to this crap,what crap
what crap,me this endless blonde babble im like boring myself
me this endless blonde babble im like boring myself,thank god if i had to hear one more story about your coiffure
i figured youd get to the good stuff eventually,what good stuff
no,okay youre gonna need to learn how to lie
wow,lets go
she okay,i hope so
they do to,they do not
did you change your hair,no
no,you might wanna think about it
where did he go he was just here,who
who,joey
great,would you mind getting me a drink cameron
he practically proposed when he found out we had the same dermatologist i mean dr bonchowski is great an all but hes not exactly relevant party conversation,is he oily or dry
is he oily or dry,combination i dont know i thought hed be different more of a gentleman
bianca i dont think the highlights of dating joey dorsey are going to include dooropening and coatholding,sometimes i wonder if the guys were supposed to want to go out with are the ones we actually want to go out with you know
sometimes i wonder if the guys were supposed to want to go out with are the ones we actually want to go out with you know,all i know is id give up my private line to go out with a guy like joey
i have to be home in twenty minutes,i dont have to be home til two
you think you re the only sophomore at the prom,i did
its more,expensive
exactly so you going to bogey lowenbraus thing on saturday,hopefully
queen harry,its a gay cruise line but ill be like wearing a uniform and stuff
neat,my agent says ive got a good shot at being the prada guy next year
hey sweet cheeks,hi joey
hi joey,youre concentrating awfully hard considering its gym class
listen i want to talk to you about the prom,you know the deal i can t go if kat doesnt go
whereve you been,nowhere hi daddy
i have the potential to smack the crap out of you if you dont get out of my way,can you at least start wearing a bra
oh my god does this mean youre becoming normal,it means that gigglepuss is playing at club skunk and were going
it means that gigglepuss is playing at club skunk and were going,oh i thought you might have a date i dont know why im bothering to ask but are you going to bogey lowensteins party saturday night
oh i thought you might have a date i dont know why im bothering to ask but are you going to bogey lowensteins party saturday night,what do you think
what do you think,i think youre a freak i think you do this to torture me and i think you suck
youre ruining my life because you wont be normal i cant be normal,whats normal
whats normal,bogey lowensteins party is normal but youre too busy listening to bitches who need prozac to know that
cant you forget for just one night that youre completely wretched,at least im not a clouted fen sucked hedgepig
like im supposed to know what that even means,its shakespeare maybe youve heard of him
its shakespeare maybe youve heard of him,yeah hes your freak friend mandellas boyfriend i guess since im not allowed to go out i should obsess over a dead guy too
you are so completely unbalanced,can we go now
bianca i need to talk to you i need to tell you,i really dont think i need any social advice from you right now
i dont get you you act like youre too good for any of this and then you go totally apeshit when you get here,youre welcome
listen i know you hate having to sit home because im not susie high school,like you care
like you care,i do care but im a firm believer in doing something for your own reasons not someone else s
i do care but im a firm believer in doing something for your own reasons not someone else s,i wish i had that luxury im the only sophomore that got asked to the prom and i cant go because you won t
joey never told you we went out did he,what
what,in th for a month
in th for a month,why
why,he was like a total babe
he was like a total babe,but you hate joey
but you hate joey,now i do back then was a different story
now i do back then was a different story,as in
he said everyone was doing it so i did it,you did what
you did what,just once afterwards i told him i didnt want to anymore i wasnt ready he got pissed then he broke up with me
why didnt you tell me,i wanted to let you make up your own mind about him
i wanted to let you make up your own mind about him,no you didnt if you really thought i could make my own decisions you wouldve let me go out with him instead of helping daddy hold me hostage
thats not,im not stupid enough to repeat your mistakes
im not stupid enough to repeat your mistakes,i guess i thought i was protecting you
i guess i thought i was protecting you,god youre just like him just keep me locked away in the dark so i cant experience anything for myself
god youre just like him just keep me locked away in the dark so i cant experience anything for myself,not all experiences are good bianca you cant always trust the people you want to
not all experiences are good bianca you cant always trust the people you want to,i guess ill never know will i
you looked beautiful last night you know,so did you
let go,you set me up
you set me up,i just wanted
i just wanted,what to completely damage me to send me to therapy forever what
what to completely damage me to send me to therapy forever what,no i just wanted
is that woman a complete fruitloop or is it just me,its just you
patrick is that a,perm
now dont get upset daddy but theres this boy and i think he might ask,no youre not dating until your sister starts dating end of discussion
no youre not dating until your sister starts dating end of discussion,what if she never starts dating
what if she never starts dating,then neither will you and ill get to sleep at night
then neither will you and ill get to sleep at night,but its not fair shes a mutant daddy
but she doesnt want to date,exactly my point
daddy i,and wherere you going
and wherere you going,if you must know we were attempting to go to a small study group of friends
if you must know we were attempting to go to a small study group of friends,otherwise known as an orgy
daddy people expect me to be there,if kats not going youre not going
oh god its starting,its just a party daddy
wear the belly before you go,daddy no
daddy no,just for a minute
promise me you wont talk to any boys unless your sister is present,why
why,because shell scare them away
daddy i want to discuss the prom with you its tomorrow night,the prom kat has a date
the prom kat has a date,no but
no but,its that hot rod joey right that s who you want me to bend my rules for
youre not going unless your sister goes end of story,fine i see that im a prisoner in my own house im not a daughter im a possession
im missing something,i have a date daddy and he s not a captain of oppression like some men we know
always a pleasure brucie,didnt have you pegged for a gigglepuss fan arent they a little too preteen bellybutton ring for you
didnt have you pegged for a gigglepuss fan arent they a little too preteen bellybutton ring for you,fan of a fan you see a couple of minors come in
fan of a fan you see a couple of minors come in,never
never,padua girls one tall decent body the other one kinda short and undersexed
padua girls one tall decent body the other one kinda short and undersexed,just sent em through
you the new guy,so they tell me
so they tell me,cmon im supposed to give you the tour
so which dakota you from,north actually howd you
north actually howd you,i was kidding people actually live there
i was kidding people actually live there,yeah a couple were outnumbered by the cows though
yeah a couple were outnumbered by the cows though,how many people were in your old school
how many people were in your old school,thirtytwo
thirtytwo,get out
get out,how many people go here
how many people go here,couple thousand most of them evil
that im used to,yeah but these guys have never seen a horse they just jack off to clint eastwood
that girl i,you burn you pine you perish
you burn you pine you perish,who is she
who is she,bianca stratford sophomore dont even think about it
bianca stratford sophomore dont even think about it,why not
why not,i could start with your haircut but it doesnt matter shes not allowed to date until her older sister does and thats an impossibility
why do girls like that always like guys like that,because theyre bred to their mothers liked guys like that and their grandmothers before them their gene pool is rarely diluted
because theyre bred to their mothers liked guys like that and their grandmothers before them their gene pool is rarely diluted,he always have that shiteating grin
he always have that shiteating grin,joey dorsey permashitgrin i wish i could say hes a moron but hes number twelve in the class and a model mostly regional stuff but hes rumored to have a big tube sock ad coming out
you know french,sure do my moms from canada
sure do my moms from canada,guess who just signed up for a tutor
guess who just signed up for a tutor,you mean id get a chance to talk to her
you mean id get a chance to talk to her,you could consecrate with her my friend
yeah just a minor encounter with the shrew,thats her biancas sister
thats her biancas sister,the mewling rampalian wretch herself
i teach her french get to know her dazzle her with charm and she falls in love with me,unlikely but even so she still cant go out with you so whats the point
what about him,you wanna go out with him
what makes you think hell do it,he seems like he thrives on danger
he seems like he thrives on danger,no kidding hes a criminal i heard he lit a state trooper on fire he just got out of alcatraz
no kidding hes a criminal i heard he lit a state trooper on fire he just got out of alcatraz,they always let felons sit in on honors biology
they always let felons sit in on honors biology,im serious man hes whacked he sold his own liver on the black market so he could buy new speakers
im serious man hes whacked he sold his own liver on the black market so he could buy new speakers,forget his reputation do you think weve got a plan or not
forget his reputation do you think weve got a plan or not,did she actually say shed go out with you
did she actually say shed go out with you,thats what i just said
you know if you do go out with bianca youd be set youd outrank everyone strictly alist with me by your side,i thought you hated those people
i thought you hated those people,hey ive gotta have a few clients when i get to wall street
you got him involved,like we had a choice besides when you let the enemy think hes orchestrating the battle youre in a position of power we let him pretend hes calling the shots and while hes busy setting up the plan you have time to woo bianca
this is it a golden opportunity patrick can ask katarina to the party,in that case well need to make it a schoolwide blow out
in that case well need to make it a schoolwide blow out,will bogey get bent
will bogey get bent,are you kidding hell piss himself with joy hes the ultimate kiss ass
number one she hates smokers,its a lung cancer issue
its a lung cancer issue,her favorite uncle
her favorite uncle,dead at fortyone
hes pretty,okay i wasnt sure
assail your ears for one night,its her favorite band
you told me that part already,hell ive just been going over the whole thing in my head and
extremely unfortunate maneuver,the hell is that what kind of guy just picks up a girl and carries her away while youre talking to her
the hell is that what kind of guy just picks up a girl and carries her away while youre talking to her,buttholus extremus but hey youre making progress
buttholus extremus but hey youre making progress,no i m not
you humiliated the woman sacrifice yourself on the altar of dignity and even the score,best case scenario youre back on the payroll for awhile
and he means that strictly in a non prisonmovie type of way,yeah well see
whatve you got for me,ive retrieved certain pieces of information on miss katarina stratford i think youll find helpful
gigglepuss is playing there tomorrow night,dont make me do it man
cameron im a little busy,its off the whole thing
what re you talking about,shes partial to joey not me
cameron do you like the girl,sure
sure,then go get her
whatd you do to her,i don t know i decided not to nail her when she was too drunk to remember it
she hates you with the fire of a thousand suns thats a direct quote,she just needs time to cool off ill give it a day
you makin any headway,she kissed me
she kissed me,where
whats the worst,you get the girl
the vintage look is over kat havent you been reading your sassy,yeah and i noticed the only part of you featured in your big kmart spread was your elbow tough break
yeah and i noticed the only part of you featured in your big kmart spread was your elbow tough break,theyre running the rest of me next month
hey do you mind,not at all
where ya goin,away
away,your sister here
leave my sister alone,and why would i do that
yeah,what do you think
two legs nice rack,yeah whatever i want you to go out with her
yeah whatever i want you to go out with her,sure sparky ill get right on it
sure sparky ill get right on it,you just said
you just said,you need money to take a girl out
you need money to take a girl out,but youd go out with her if you had the cake
you got it verona i pick up the tab you do the honors,youre gonna pay me to take out some girl
youre gonna pay me to take out some girl,i cant date her sister until that one gets a boyfriend and thats the catch she doesnt want a boyfriend
i cant date her sister until that one gets a boyfriend and thats the catch she doesnt want a boyfriend,how much
i cant take a girl like that out on twenty bucks,fine thirty
take it or leave it this isnt a negotiation,fifty and youve got your man
when i shell out fifty i expect results,im on it
im on it,watching the bitch trash my car doesnt count as a date
watching the bitch trash my car doesnt count as a date,i got her under control she just acts crazed in public to keep up the image
i just upped my price,what
what,a hundred bucks a date
a hundred bucks a date,forget it
forget it,forget her sister then
its about time,a deals a deal
howd you do it,do what
do what,get her to act like a human
i dont know dorsey the limothe flowers another hundred for the tux,enough with the barbie n ken shit i know
hey,are you lost
are you lost,nope just came by to chat
nope just came by to chat,we dont chat
we dont chat,well actually i thought id run an idea by you you know just to see if youre interested
well actually i thought id run an idea by you you know just to see if youre interested,were not
but she cant go out with you because her sister is this insane head case and no one will go out with her right,does this conversation have a purpose
does this conversation have a purpose,so what you need to do is recruit a guy wholl go out with her someone whos up for the job
i hear youre helpin verona,uh yeah were old friend
uh yeah were old friend,you and verona
you and verona,what we took bathes together when we were kids
you better not fuck this up im heavily invested,hey its all for the higher good right
whos that,patrick verona random skid
patrick verona random skid,thats pat verona the one who was gone for a year i heard he was doing porn movies
thats pat verona the one who was gone for a year i heard he was doing porn movies,im sure hes completely incapable of doing anything that interesting
im sure hes completely incapable of doing anything that interesting,he always look so
he always look so,block e
mandella eat starving yourself is a very slow way to die,just a little
whats this,an attempted slit
i realize that the men of this fine institution are severely lacking but killing yourself so you can be with william shakespeare is beyond the scope of normal teenage obsessions youre venturing far past daytime talk show fodder and entering the world of those who need very expensive therapy,but imagine the things hed say during sex
the people at this school are so incredibly foul,you could always go with me im sure william has some friends
so he has this huge raging fit about sarah lawrence and insists that i go to his maledominated puking frat boy number one golf team school i have no say at all,william would never have gone to a state school
william would never have gone to a state school,william didnt even go to high school
william didnt even go to high school,thats never been proven
thats never been proven,neither has his heterosexuality
i appreciate your efforts toward a speedy death but im consuming do you mind,does it matter
you think thisll work,no fear
whatd he say,who cares
you went to the party i thought we were officially opposed to suburban social activity,i didnt have a choice
i didnt have a choice,you didnt have a choice wheres kat and what have you done with her
you didnt have a choice wheres kat and what have you done with her,i did bianca a favor and it backfired
i did bianca a favor and it backfired,you didnt
you didnt,i got drunk i puked i got rejected it was big fun
can you even imagine who the hell would go to this a bastion of commercial excess,well i guess were not since we dont have dates
well i guess were not since we dont have dates,listen to you you sound like betty all pissed off because archie is taking veronica
listen to you you sound like betty all pissed off because archie is taking veronica,okay okay we wont go its not like i have a dress anyway
okay okay we wont go its not like i have a dress anyway,you re looking at this from the wrong perspective were making a statement
you re looking at this from the wrong perspective were making a statement,oh good something new and different for us
have you seen him,who
who,william he asked me to meet him here
william he asked me to meet him here,oh honey tell me we havent progressed to fullon hallucinations
i mean woman how ya doin,sweating like a pig actually and yourself
sweating like a pig actually and yourself,theres a way to get a guys attention
theres a way to get a guys attention,my mission in life
pick you up friday then,oh right friday
the night i take you to places youve never been before and back,like where the eleven on burnside do you even know my name screwboy
like where the eleven on burnside do you even know my name screwboy,i know a lot more than that
you hate me dont you,i dont really think you warrant that strong an emotion
i dont really think you warrant that strong an emotion,then say youll spend dollar night at the track with me
then say youll spend dollar night at the track with me,and why would i do that
and why would i do that,come on the ponies the flat beer you with money in your eyes me with my hand on your ass
come on the ponies the flat beer you with money in your eyes me with my hand on your ass,you covered in my vomit
you covered in my vomit,seventhirty
are you following me,i was in the laundromat i saw your car thought id say hi
i was in the laundromat i saw your car thought id say hi,hi
youre not a big talker are you,depends on the topic my fenders dont really whip me into a verbal frenzy
excuse me,thats what you want isnt it
thats what you want isnt it,do you mind youre sort of ruining it for me
you know these guys are no bikini kill or the raincoats but theyre right up there,you know who the raincoats are
you know who the raincoats are,why dont you
i say do what you wanna do,funny youre the only one
okay,im fine im
youre not okay,i just need to lie down for awhile
i just need to lie down for awhile,uh uh you lie down and youll go to sleep
uh uh you lie down and youll go to sleep,i know just let me sleep
i know just let me sleep,what if you have a concussion my dog went to sleep with a concussion and woke up a vegetable not that i could tell the difference
this is so patronizing,leave it to you to use big words when youre shitfaced
leave it to you to use big words when youre shitfaced,why re you doing this
why re you doing this,i told you
i told you,you dont care if i die
you dont care if i die,sure i do
sure i do,why
why,because then id have to start taking out girls who like me
because then id have to start taking out girls who like me,like you could find one
like you could find one,see that who needs affection when ive got blind hatred
see that who needs affection when ive got blind hatred,just let me sit down
whyd you let him get to you,who
who,dorsey
dorsey,i hate him
i hate him,i know itd have to be a pretty big deal to get you to mainline tequila you dont seem like the type
i thought you were above all that,you know what they say
kat wake up,what
and im in control of it,but its gigglepuss i know you like them i saw you there
when you were gone last year where were you,busy
busy,were you in jail
were you in jail,maybe
maybe,no you werent
no you werent,then whyd you ask
then whyd you ask,whyd you lie
i should do this,do what
do what,this
start a band,my father wouldnt approve of that that
my father wouldnt approve of that that,you dont strike me as the type that would ask permission
oh so now you think you know me,im gettin there
so what s up with your dad he a pain in the ass,he just wants me to be someone im not
he just wants me to be someone im not,who
who,bianca
bianca,no offense but youre sister is without i know everyone likes her and all but
excuse me have you seen the feminine mystique i lost my copy,what are you doing here
what are you doing here,i heard there was a poetry reading
i heard there was a poetry reading,you re so
you re so,pleasant
wholesome,unwelcome
unwelcome,unwelcome i guess someone still has her panties in a twist
unwelcome i guess someone still has her panties in a twist,dont for one minute think that you had any effect whatsoever on my panties
dont for one minute think that you had any effect whatsoever on my panties,so what did i have an effect on
so what did i have an effect on,other than my upchuck reflex nothing
he left i sprung the dickhead and he cruised on me,look up sunshine
i guess i never told you im afraid of heights,cmon its not that bad
cmon its not that bad,try lookin at it from this angle
put your right foot there,forget it im stayin
forget it im stayin,you want me to climb up and show you how to get down
you want me to climb up and show you how to get down,maybe
the partridge family,i figured it had to be something ridiculous to win your respect and piss you off
i figured it had to be something ridiculous to win your respect and piss you off,good call
good call,so howd you get chapin to look the other way
so howd you get chapin to look the other way,i dazzled him with my wit
a soft side who knew,yeah well dont let it get out
yeah well dont let it get out,so whats your excuse
so whats your excuse,acting the way we do
acting the way we do,yes
yes,i dont like to do what people expect then they expect it all the time and they get disappointed when you change
