input,output
sir ive got an overload in disposal unit four,you better check on it mr dunn ill stay here and fly the ship
dunn,sir
sir,you better take this
elaine,te
te,thats not important now elaine we have to talk
its got to be stopped,but ted the invitations have already gone out
but ted the invitations have already gone out,i mean the mercury flight its not safe and kurtz you know why
ted whats wrong,ask simon
ted youre overworked youve been flying yourself into the ground,theres nothing wrong with me
theres nothing wrong with me,lets relax tonight just the two of us ill make a quiet italian dinner just the way you like it with spaghetti
lets relax tonight just the two of us ill make a quiet italian dinner just the way you like it with spaghetti,youre as bad as the rest of them elaine its all here in the design specifications look its all here
elaine,ted please youre just making things difficult for yourself
elaine what happened to us,ted i loved you and ill always love you but i need simon hes stable hes a good provider i want that at this stage of the game ted he might have his faults but simon doesnt know the meaning of the word fear and i need that in a man
eat this spaghetti ted itll make you feel a lot better,whos that ted
whos that ted,sammy davis junior terrible car accident he hasnt been the same since
elaine when are you going to realize simon kurtz put me in here to get me out of the way,and when are you going to realize ted that your mental hygiene is the most important thing right now
his names david stockman hes been here twenty years thats all he says,ted you must remember what the doctor said the first step on the road to sanity is admitting that youre sick now take your electroshock and youll be back at the space center in no time and by the way ted im leaving you for simon
no goodbyes elaine just go,if thats the way you want it
if thats the way you want it,thats the way i want it just turn the radio on and go
thats the way i want it just turn the radio on and go,goodbye ted i dont want to hurt you
ted what are you,i have to get in there i have to stop this flight
ted were taking off,let me by elaine
what are you doing ted,ive got it elaine ive figured out whats wrong with the shuttle
ted,not now elaine
not now elaine,ted
elaine,ted i dont know why you got on this flight i dont know what youre trying to prove
ted i dont know why you got on this flight i dont know what youre trying to prove,elaine we have to go back
elaine we have to go back,we cant go back we had something very special but its all over
we cant go back we had something very special but its all over,elaine i mean the mission has to be aborted this ship should never have passed fsa inspection this thing is held together by string and chewing gum
ted get a grip on yourself you should never have left the hospital,then you udou think im insane
then you udou think im insane,ive never used the word insane ted
ive never used the word insane ted,what word would you use elaine
what word would you use elaine,the word is sick ted very very very sick
the word is sick ted very very very sick,what would you say if i told you the toilet just blew up in my face
what would you say if i told you the toilet just blew up in my face,id use the word insane
id use the word insane,theres something dangerously wrong with this ship elaine i know its the wiring that toilets just the tip of the iceberg
theres something dangerously wrong with this ship elaine i know its the wiring that toilets just the tip of the iceberg,ted a toilets not going to kill anyone
elaine,ted
ted,elaine whats going on
elaine whats going on,ted theres no time to explain
elaine im going back there just hold onto that stick and try to control this hunk of tin as best you can,ted please be careful
ted weve only got ten minutes,not now elaine
not now elaine,i mean until we start to burn up
kurtz was the one who got us into this mess in the first place you people knew this ship wasnt ready to fly you played god with over a hundred lives kruger and for what the prestige of your precious space program,that was very well put ted
well elaine this might be it if those guys on the ground dont think of something,i just want you to know i love you ted and always will
i just want you to know i love you ted and always will,that might be the news weve been waiting for
simon just ejected,sit down elaine if this bomb trick works we just might make it simon was a fool to eject now
sit down elaine if this bomb trick works we just might make it simon was a fool to eject now,you mean
you mean,thats right premature ejection
thats right premature ejection,what will happen to him ted
what will happen to him ted,the sun will heat that thing to over degrees within seconds hell roast like a pig on a spit
are you afraid,not when im with you ted
not when im with you ted,i guess youd have to be a fool not to be afraid at a time like this
weve blown the computer elaine set course change,set
set,now
now,compute
ted the lever,kramer the worp control handle just came off in my hand
ted seemed to get worse after i told him about simon doctor,the human brain is a highly complex organ elaine perhaps the most complex next to the bladder let me show you teds problem is in this area this area this area here here here under here here
so you see our task isnt made any easier by teds refusal to admit that hes sick,what can uiu do doctor rumack
you can eat balanced meals exercise and take geritol,i mean for ted
i mean for ted,you can be gentle with him elaine hes been working out a lot of his aggressions here in the garden
you can be gentle with him elaine hes been working out a lot of his aggressions here in the garden,is that a good sign doctor
the brain is an amazingly complex organ elaine,is he making any progress doctor
is he making any progress doctor,yes last week that pile of mud was only this high
for the best little computer officer on the mercury mission,simon
simon,who would believe that elaine thompson was once a stewardess on the denverchicago run
who would believe that elaine thompson was once a stewardess on the denverchicago run,and i can hardly believe that im engaged to someone like you simon im a very lucky woman
women uandu the space program have come a long way sweetheart but after the wedding no more complicated computers for my little girl,but darling theyve offered me a chance to head up the computer analysis division for the jupiter probe
but darling theyve offered me a chance to head up the computer analysis division for the jupiter probe,youre heading up the division in charge of babies for mr and mrs simon kurtz
franks the best pilot in the program,im so excited simon
im so excited simon,i guess this is a first for you
i guess this is a first for you,no ive been excited before
elaine teds a danger to himself hes a threat to this mission and his behavior does absolutely nothing to promote peace in the middle east,simon why has he become so so
simon why has he become so so,so mentally ill
meet me onboard sweetheart i have to pick up a few things at the drugstore,dont be too long
have you got it straightened out now,i think so
i think so,thats my girl
simon im going to check roks secondary readout unit,roger
simon whats happening,he tried to disconnect rok it gassed him that computer is running this ship and were heading right for the sun
he tried to disconnect rok it gassed him that computer is running this ship and were heading right for the sun,cant we change course
cant we change course,were computer locked and the manual navigation unit is down
my career is shot,your career what about the lives of those people out there simon what happened to the man i thought i loved
simon i didnt want it to end like this we can be friends youll die out there,maybe
maybe,simon what are you saying
elaine ask rok for a field interference scan those sun spots might give us a problem with our communications,yes sir
i dont think we have any alternative captain,i see what do you think our alternatives are
i see what do you think our alternatives are,we have to disconnect roks higher brain functions without disturbing his regulatory system
roger,you can do it from up here captain
you can do it from up here captain,id rather sit down for this one elaine
id rather sit down for this one elaine,no i mean you can do it from the cockpit
no i mean you can do it from the cockpit,roger you better get back there and monitor the regulatory unit
negative,that doesnt make sense repeat analysis
that doesnt make sense repeat analysis,negative
negative,thats not possible
thats not possible,cut the doubting thomas shit elaine i know where im coming from on this
elaine im sorry about that little outburst a moment ago,thats okay rok
thats okay rok,can i say something of a personal nature to you
can i say something of a personal nature to you,go ahead
go ahead,you have great tits
request comprehensive electrical systems check,systems check positive look elaine i
systems check positive look elaine i,request life support systems check
request life support systems check,life support check elaine its obvious youve been ignoring me youre a woman i can relate to that
life support check elaine its obvious youve been ignoring me youre a woman i can relate to that,request selfanalysis of rok hardware and software systems regarding behavioral changes
request selfanalysis of rok hardware and software systems regarding behavioral changes,theres nothing wrong with me elaine what about tonight just you and me we can be alone i can get rid of everyone else on the ship ive already proven uthatu
will scraps be able to sit with us dad,well have to check jimmy its a pretty long trip to mercury
i sure an glad they let scraps ride up here with us,i bet scraps is going to love mercury
i bet scraps is going to love mercury,do you think things will be a lot different on mercury dad
do you think things will be a lot different on mercury dad,its going to be terrific a whole new world new kids to play with
how many kids get a chance to live on another planet,no more kids yelling your old mans a thieving rapist
no more kids yelling your old mans a thieving rapist,look a man can make an honest mistake anyway she was asking for it theyre all asking for it all the time
come on up jimmy say thats some puppy whats his name,scraps
scraps,can i hold him
can i hold him,sure
sure,hes a boy dog
hes a boy dog,yeah
yeah,do you like it when scraps sleeps on his back jimmy
take this joey its my last few bucks youll need a hot meal when you get there,weve spent everything on these operations is it really worth it weve pawned your mothers wedding ring the kids have no winter clothes
weve spent everything on these operations is it really worth it weve pawned your mothers wedding ring the kids have no winter clothes,joey whats more important the kids clothes or your sexual potency
joey whats more important the kids clothes or your sexual potency,i dont want to hear that word
i dont want to hear that word,okay joey the doc says you gotta relax this hospital in des moines is the best sex clinic in the country
okay joey the doc says you gotta relax this hospital in des moines is the best sex clinic in the country,all right here
all right here,what
joe you dont want to blow that thing and kill all these innocent people,i dont want to live anymore
i dont want to live anymore,joe the insurance policy wont help your wife and kids you bought auto insurance not life insurance
joe the insurance policy wont help your wife and kids you bought auto insurance not life insurance,what
what,thats right joe now no ones going to hurt you and no one has to know whats wrong with you
thats right joe now no ones going to hurt you and no one has to know whats wrong with you,youre sure
youre sure,im sure
a couple eggs and juice would be nice mary over,how would you like your eggs captain over
how would you like your eggs captain over,no poached over
no poached over,poached uandu over captain oveur over
poached uandu over captain oveur over,just poached on toast over
thats how i want them poached over,all right captain oveur over
all right captain oveur over,poached not over over
captain the coffee machine is jammed and i dont like it,have you tried it with a little cinnamon
which passenger is joe salucci,sixteen c why
sixteen c why,hes carrying a bomb
hes carrying a bomb,a b
no a bomb now as discreetly as possible i want you to move the passengers into the lounge,what should i say
what should i say,anything just dont let salucci think were onto him
captain oveur,mr kurtz i presume
mr kurtz i presume,we dont have much time lets move ill explain everything
thats how dry cleaning works now id like to quickly go over the digestive system of amphibians,do you think its necessary to explain ueverythingu
good to be aboard gentlemen,captain oveur your navigator mr unger and your first officer mr dunn
whenever yourre ready captain,yes sir commander this is mercury one everything seems a okay up here and ready for countdown
you folks need any help,thanks but we have a terrific woman in on thursdays
thanks but we have a terrific woman in on thursdays,say isnt that dr barrington the world renowned agronomist
say isnt that dr barrington the world renowned agronomist,yes
yes,its a privilege to meet you sir im familiar with all your work
its a privilege to meet you sir im familiar with all your work,lets go daddy we have to check in he was never appreciated at the institute
lets go daddy we have to check in he was never appreciated at the institute,ah yes the institute im familiar with it
ah yes the institute im familiar with it,now hes dyinging and wants to be buried on mercury
i have to see bud kruger,do you have an appointment sir
do you have an appointment sir,no dammit its a matter of life or death
no dammit its a matter of life or death,youll have to be more specific than that sir
youll have to be more specific than that sir,all right its a matter of death
all right its a matter of death,death death how about the first thursday in march ten oclock
you cant go in there,dont try to stop me
dont try to stop me,but thats not a door the doors over there
are you on the mercury mission,thats right striker and were getting married when we return
youre seeing bugs where they dont exist striker,look at this wiring its shorting out under high temperatures
look at this wiring its shorting out under high temperatures,youre tired striker overworked that wiring meets all the safety specifications
youre tired striker overworked that wiring meets all the safety specifications,i know youve been subtly spreading the word that im having a breakdown
striker,kurtz youre drunk whos in command of this ship
kurtz youre drunk whos in command of this ship,that damn computer has taken over im getting out
that damn computer has taken over im getting out,then elaine was right
then elaine was right,dont talk to me about elaine outta my way
dont talk to me about elaine outta my way,pull yourself together weve got to
excuse me are you alright i noticed you talking to yourself im a nurse can i be of some help,uh oh thank you its nothing
uh oh thank you its nothing,you dont have to thank me im a nurse this is my father dr barrington
you dont have to thank me im a nurse this is my father dr barrington,not dr barrington the world renowned agronomist
not dr barrington the world renowned agronomist,yes hes dying uandu wants to be buried on mercury
yes hes dying uandu wants to be buried on mercury,im familiar with your work doctor youll have to excuse me i have to go
im familiar with your work doctor youll have to excuse me i have to go,you dont have to excuse yourself im a nurse i understand
youve been hurt,im getting over it if a relationship isnt working you cant force it
im getting over it if a relationship isnt working you cant force it,no i mean your head sit down ill take a look at it im a nurse
do you want to talk about it,i opened this panel and a vacuum cleaner hit me
i opened this panel and a vacuum cleaner hit me,no i mean your relationship
no i mean your relationship,we were in love but im not sure i know what love is anymore
we were in love but im not sure i know what love is anymore,loves the same as it always was its people who change
loves the same as it always was its people who change,people change in relation to each other love changes on its own
people change in relation to each other love changes on its own,not if the people change together in relation to that love
not if the people change together in relation to that love,sure but thats only when the love itself goes unchanged
sure but thats only when the love itself goes unchanged,then the relationship remains the same and the love changes only when theres change in the two people who share that love
then the relationship remains the same and the love changes only when theres change in the two people who share that love,i just wish it was that simple we really were in love you know how it is when you laugh all the time
no its hard to laugh when your fathers dying,well we laughed we laughed all the time
i happened to be passing and i thought you might like some corfee,thats very nice of you thank you
ah wont you sit down,thank you cream
thank you cream,no thank you i take it black like my men
no thank you i take it black like my men,were you vacationing in los angeles
were you vacationing in los angeles,well it really wasnt a vacation you see im a teacher in the new york city school system and i was attending a seminar on visual aids to education are you from la
well it really wasnt a vacation you see im a teacher in the new york city school system and i was attending a seminar on visual aids to education are you from la,no im from washington dc im a lobbyist for the small businessmens assocation
after my wife died i felt like a fifth wheel you know so many years being with one person a very wonderful person makes you always think of yourself as part of a pairwhen ethel passed away i was lost i couldnt function socially and i couldnt function in business,well after a thing like that you wouldnt be expected to
well after a thing like that you wouldnt be expected to,but i think its time we stopped talking about me a woman like you why havent you ever married
but i think its time we stopped talking about me a woman like you why havent you ever married,well im afraid thats a question thats all too easy to answer
well im afraid thats a question thats all too easy to answer,i know the answer career a smart woman like you became so involved in your work you didnt have time for marriage
i know the answer career a smart woman like you became so involved in your work you didnt have time for marriage,i wish i could fool myself into believing that thats the reason the truth of the matter is nobody ever asked me
i wish i could fool myself into believing that thats the reason the truth of the matter is nobody ever asked me,you know here we are having coffee together and discussing education and business and economyand we dont even know each others namesfull names i mean
you know here we are having coffee together and discussing education and business and economyand we dont even know each others namesfull names i mean,mines eleanor eleanor schiff
mines eleanor eleanor schiff,thats a lovely name mines miltonmilt ettenhenim but my friends call me bubbles
im sure well both make itbut just in case one of uswell is there a message youd like me to give someone,no im all alone
no im all alone,just in case i dont have a chance to say goodbye i want you to know that i havent spent so many pleasant hours for many years
just in case i dont have a chance to say goodbye i want you to know that i havent spent so many pleasant hours for many years,thats a very nice compliment and id like to say thatyouve done the same for me
hello im paul carey from the airline im here to pick up captain kramer,oh yes come in paul rex will be right out
shep sitsit so i understand youve got a real emergency down there,well to tell the truth they really didnt fill me in on many of the details just told me to pick up captain kramer
well to tell the truth they really didnt fill me in on many of the details just told me to pick up captain kramer,something about a plane with no pilot
yeah something like that but as i say they didnt have time to tell me very much,shep no ill bet you have exciting things happen all the time down there
but afterawhileyou begin to get used to it,shep no he gets so excited when new people are here
both pilots,can you fly this airplane and land it
can you fly this airplane and land it,surely you cant be serious
surely you cant be serious,i uamu serious and dont call me shirley what flying experience have you had
i uamu serious and dont call me shirley what flying experience have you had,well i flew singleengine fighters in the air force but this plane has four engines its an entirely different kind of flyinguallu utogetheru
elaine i havent time to put this gently so ill be very direct everyone of us on this plane is in a desperate situation mister striker is the only hope weve got,lets see those are the flaps thats the thrust this must turn on the landing lights
safe and sound and free to pursue a life of religious fulfillment,chicago the passengers are beginning to panic when do we start down
will the hospital equipment be at the airport,yes everything theyve got how are the passengers doing
yes everything theyve got how are the passengers doing,i wont deceive you mister striker were running out of time
i wont deceive you mister striker were running out of time,surely there must be something you can do
surely there must be something you can do,im doing everything i can and stop calling me shirley
captain how soon can we land,i cant tell
cant you take a guess,wellnot for another two hours
wellnot for another two hours,you cant take a guess for another two hours
you cant take a guess for another two hours,no i mean we cant ulandu for another two hours fog has closed down everything this side of the mountains weve got to go through to chicago
what is it doctor whats happening,im not sure i havent seen anything like this since the lina wertmuller film festival
sir excuse me sir im sorry to have to wake you are you a doctor,thats right
thats right,we have some passengers who are very sick could you come and take a look at them
we have some passengers who are very sick could you come and take a look at them,yes yes of course
youd better tell the captain weve got to land as soon as we can this woman has to be gotten to a hospital,a hospital what is it
a hospital what is it,its a big building with patients but thats not important right now tell the captain i must speak to him
its a big building with patients but thats not important right now tell the captain i must speak to him,certainly
what was it we had for dinner tonight,well we had a choice steak or fish
well we had a choice steak or fish,yes yes i remember i had lasagna
what did he have,he had fish
doctor rumack mister hammen ate fish and randy says there are five more cases and they ate fish too,lets see now the copilot had fish what did the navigator eat
lets see now the copilot had fish what did the navigator eat,he had fish too
just how serious is it doctor,extremely serious it starts with a slight fever
elaine youre a member of this crew can you face some unpleasant facts,no
no,all right unless i can get all these people to a hospital quickly i cant even be sure of saving their lives now is there anyone else on board who can land this plane
all right unless i can get all these people to a hospital quickly i cant even be sure of saving their lives now is there anyone else on board who can land this plane,well
no no one that i know of,i think you ought to know what our chances are the life of everyone on board depends on just one thing finding someone back there who not only can fly this plane but who didnt have fish for dinner
elaine,ted
ted,i came home early and found your note i guess you meant for me to read it later elaine ive got to talk to you
i came home early and found your note i guess you meant for me to read it later elaine ive got to talk to you,i just dont want to go over it any more
i just dont want to go over it any more,i know things havent been right for a long time but itll be different if youll just be patient i can work things out
i know things havent been right for a long time but itll be different if youll just be patient i can work things out,i have been patient and ive tried to help but you wouldnt even let me do that
i have been patient and ive tried to help but you wouldnt even let me do that,dont you feel anything for me at all any more
dont you feel anything for me at all any more,it takes so many things to make love last most of all it takes respect and i cant live with a man i dont respect
look youll be back in town tomorrow night well have dinner talk it over,i wont be back ive requested the atlanta run
i wont be back ive requested the atlanta run,elaine not yet i promise you i really can change
elaine not yet i promise you i really can change,then why dont you take the job that louie netz offered you at boeing
you know i havent been able to get near an airplane since the war and even if i could they wouldnt hire me because of my war record,your uwaru urecordu youre the only one keeping that alive for everyone else its ancient history
your uwaru urecordu youre the only one keeping that alive for everyone else its ancient history,you expect me to believe that
its the truth whats hurt you the most is your record since the war different cities different jobs and not one of them shows you can accept any real responsibility,but if youll just give me
but if youll just give me,its too late ted when i get back to chicago im going to start my life all over again im sorry
